date,headline,sentiment_code,sentiment_label
2025-03-30,BYD Energy Storage Launches Chess Plus for C&I Energy Storage in China,2,Positif
2025-03-25,Chinese EV titan BYD eclipses Tesla with annual sales of more than $100 billion,1,Neutre
2025-03-25,"Chinese electric vehicle maker BYD reports 2024 revenue over $100B, topping Tesla’s sales",1,Neutre
2025-03-25,Tesla’s No.1 rival BYD is practically taunting Elon Musk now,2,Positif
2025-03-24,BYD’s Sales Soar as Chinese Carmaker Captures World’s Attention,1,Neutre
