date,headline,sentiment_code,sentiment_label
2025-03-11,"AMD Unveils 5th Gen AMD EPYC Embedded Processors Delivering Leadership Performance, Efficiency and Long Product Lifecycles for Networking, Storage, and Industrial Edge Markets",2,Positif
2025-03-10,CloudBees Celebrates 15 Years of DevOps Industry Impact and Continued Innovation,2,Positif
2025-02-18,"Cisco, IBM, Oracle show old-school tech can be AI winners",2,Positif
2025-02-13,Blackline Safety Appoints Paul Semak as Vice President of North American Sales,2,Positif
2025-02-12,Cisco Gains After AI-Fueled Networking Spending Lifts Forecast,1,Neutre
