date,headline,sentiment_code,sentiment_label
2025-03-31,"Powered by 5th Gen AMD EPYC CPUs, Oracle Cloud Infrastructure Compute E6 Shapes Deliver Breakthrough Cloud Performance and Efficiency",2,Positif
2025-03-23,"Oracle hack: Big business, government on alert over Oracle cyberattack claims",2,Positif
2025-03-06,Introducing Spinnaker Cloud Managed Services: Empowering Organizations to Modernize on Their Own Terms and Timeline,2,Positif
2025-02-18,"Cisco, IBM, Oracle show old-school tech can be AI winners",2,Positif
2025-02-11,Oracle Red Bull Racing and 1Password Upgrade Security in Multi-Year Partnership,2,Positif
